video_id,comment_text,likes,replies,comment_published_at,clean_comment,sentiment_score,sentiment_label,disengagement_keyword_flag
vF6zX_NGYts,सैमसंग a57 5G कब लॉन्च हो रहा है,0,0,2026-03-22T15:26:12Z,a57 5g,0.0,neutral,0
vF6zX_NGYts,Samsung A57 5G,0,0,2026-03-22T15:25:37Z,samsung a57 5g,0.0,neutral,0
vF6zX_NGYts,7:24 thank me later,1,0,2026-03-22T15:23:54Z,7 24 thank me later,0.0,neutral,0
vF6zX_NGYts,Bjp agent na na na na 😅😅,0,0,2026-03-22T15:14:59Z,bjp agent na na na na,0.0,neutral,0
vF6zX_NGYts,"#bologuruji running brand or business secretary vs making hype or revealing it on social media for better sales. Why you choosed privacy in business, is their any problem announcing it publicly?🤍",1,0,2026-03-22T15:14:34Z,bologuruji running brand or business secretary vs making hype or revealing it on social media for better sales why you choosed privacy in business is their any problem announcing it publicly,0.0,neutral,0
vF6zX_NGYts,#bologuruji how you balanced between mehnat and fun(like watching dhurendar2 2 times). is their any formula to calculate how much fun & how much hardwork is required?,0,0,2026-03-22T15:11:35Z,bologuruji how you balanced between mehnat and fun like watching dhurendar2 2 times is their any formula to calculate how much fun how much hardwork is required,0.5,positive,0
vF6zX_NGYts,kya hi farak padta hai bhai pr paisa hi paisa.. 8:55,0,0,2026-03-22T15:07:59Z,kya hi farak padta hai bhai pr paisa hi paisa 8 55,0.0,neutral,1
vF6zX_NGYts,Middle East ma movie ban ha 😂,1,0,2026-03-22T15:07:33Z,middle east ma movie ban ha,0.0,neutral,0
vF6zX_NGYts,#lodu_guruji,0,0,2026-03-22T15:06:40Z,lodu guruji,0.0,neutral,0
vF6zX_NGYts,"#bologuruji
लगता है गौरव भाई audience अब अपने सवाल ChatGPT से ही पूछ लेती होगी, STM में user engagment अब काफी कम हो गया है over the last few years. What's your opinion on this?",0,0,2026-03-22T15:04:02Z,bologuruji audience chatgpt stm user engagment over the last few years what s your opinion on this,0.0,neutral,0
vF6zX_NGYts,5G Pakistan ma launch ho gaya ha os per b video bna o 🎉 #bologuruji,1,0,2026-03-22T15:01:03Z,5g pakistan ma launch ho gaya ha os per b video bna o bologuruji,0.0,neutral,0
vF6zX_NGYts,"#bologuruji sir! mai  content creator hu , mujhe mac book neo lena chahiye ya koi or apple device?? Mai i phone 17 par Vdo shoot karti hu ! Bahut confused hu kya karu! Neo kasa rahega?? VN, cap cut , inshot par editing karne k liye! Plz plz plz reply sir!",0,0,2026-03-22T14:59:49Z,bologuruji sir mai content creator hu mujhe mac book neo lena chahiye ya koi or apple device mai i phone 17 par vdo shoot karti hu bahut confused hu kya karu neo kasa rahega vn cap cut inshot par editing karne k liye plz plz plz reply sir,0.0,neutral,0
vF6zX_NGYts,"#bologuruji sir! mai  content creator hu , mujhe mac book neo lena chahiye ya koi or apple device?? Mai i phone 17 par Vdo shoot karti hu ! Bahut confused hu kya karu! Neo kasa rahega?? VN, cap cut , inshot par editing karne k liye! Plz plz plz reply sir!",0,0,2026-03-22T14:59:38Z,bologuruji sir mai content creator hu mujhe mac book neo lena chahiye ya koi or apple device mai i phone 17 par vdo shoot karti hu bahut confused hu kya karu neo kasa rahega vn cap cut inshot par editing karne k liye plz plz plz reply sir,0.0,neutral,0
vF6zX_NGYts,"#bologuruji sir! mai  content creator hu , mujhe mac book neo lena chahiye ya koi or apple device?? Mai i phone 17 par Vdo shoot karti hu ! Bahut confused hu kya karu! Neo kasa rahega?? VN, cap cut , inshot par editing karne k liye! Plz plz plz reply sir!",0,0,2026-03-22T14:59:30Z,bologuruji sir mai content creator hu mujhe mac book neo lena chahiye ya koi or apple device mai i phone 17 par vdo shoot karti hu bahut confused hu kya karu neo kasa rahega vn cap cut inshot par editing karne k liye plz plz plz reply sir,0.0,neutral,0
vF6zX_NGYts,"#bologuruji sir! mai  content creator hu , mujhe mac book neo lena chahiye ya koi or apple device?? Mai i phone 17 par Vdo shoot karti hu ! Bahut confused hu kya karu! Neo kasa rahega?? VN, cap cut , inshot par editing karne k liye! Plz plz plz reply sir!",0,0,2026-03-22T14:59:22Z,bologuruji sir mai content creator hu mujhe mac book neo lena chahiye ya koi or apple device mai i phone 17 par vdo shoot karti hu bahut confused hu kya karu neo kasa rahega vn cap cut inshot par editing karne k liye plz plz plz reply sir,0.0,neutral,0
vF6zX_NGYts,"#bologuruji sir! mai  content creator hu , mujhe mac book neo lena chahiye ya koi or apple device?? Mai i phone 17 par Vdo shoot karti hu ! Bahut confused hu kya karu! Neo kasa rahega?? VN, cap cut , inshot par editing karne k liye! Plz plz plz reply sir!",0,0,2026-03-22T14:59:14Z,bologuruji sir mai content creator hu mujhe mac book neo lena chahiye ya koi or apple device mai i phone 17 par vdo shoot karti hu bahut confused hu kya karu neo kasa rahega vn cap cut inshot par editing karne k liye plz plz plz reply sir,0.0,neutral,0
vF6zX_NGYts,"#bologuruji sir! mai  content creator hu , mujhe mac book neo lena chahiye ya koi or apple device?? Mai i phone 17 par Vdo shoot karti hu ! Bahut confused hu kya karu! Neo kasa rahega?? VN, cap cut , inshot par editing karne k liye! Plz plz plz reply sir!",0,2,2026-03-22T14:59:05Z,bologuruji sir mai content creator hu mujhe mac book neo lena chahiye ya koi or apple device mai i phone 17 par vdo shoot karti hu bahut confused hu kya karu neo kasa rahega vn cap cut inshot par editing karne k liye plz plz plz reply sir,0.0,neutral,0
vF6zX_NGYts,"#bologuruji sir! mai  content creator hu , mujhe mac book neo lena chahiye ya koi or apple device?? Mai i phone 17 par Vdo shoot karti hu ! Bahut confused hu kya karu! Neo kasa rahega?? VN, cap cut , inshot par editing karne k liye! Plz plz plz reply sir!",0,0,2026-03-22T14:58:58Z,bologuruji sir mai content creator hu mujhe mac book neo lena chahiye ya koi or apple device mai i phone 17 par vdo shoot karti hu bahut confused hu kya karu neo kasa rahega vn cap cut inshot par editing karne k liye plz plz plz reply sir,0.0,neutral,0
vF6zX_NGYts,"#bologuruji sir! mai  content creator hu , mujhe mac book neo lena chahiye ya koi or apple device?? Mai i phone 17 par Vdo shoot karti hu ! Bahut confused hu kya karu! Neo kasa rahega?? VN, cap cut , inshot par editing karne k liye! Plz plz plz reply sir!",0,0,2026-03-22T14:58:49Z,bologuruji sir mai content creator hu mujhe mac book neo lena chahiye ya koi or apple device mai i phone 17 par vdo shoot karti hu bahut confused hu kya karu neo kasa rahega vn cap cut inshot par editing karne k liye plz plz plz reply sir,0.0,neutral,0
vF6zX_NGYts,#bologuruji mujhe vivo x300 pro lena hai mere pass kuch rupee hai or nhii saveing kr rpaa rha hun please help kr dijiye thoda #boliyeguruji,0,0,2026-03-22T14:53:29Z,bologuruji mujhe vivo x300 pro lena hai mere pass kuch rupee hai or nhii saveing kr rpaa rha hun please help kr dijiye thoda boliyeguruji,0.0,neutral,0
vF6zX_NGYts,Dhurandhar ❤,1,0,2026-03-22T14:51:50Z,dhurandhar,0.0,neutral,0
vF6zX_NGYts,Pls sir ye batayen ki oppo f31 pro plus kaisa camera phone h,0,0,2026-03-22T14:50:48Z,pls sir ye batayen ki oppo f31 pro plus kaisa camera phone h,0.0,neutral,0
vF6zX_NGYts,4:40,0,0,2026-03-22T14:50:26Z,4 40,0.0,neutral,0
vF6zX_NGYts,"main toh apka big fan hu sir 
but kya kare Nhi toh gift Iphone mila aaj mujhe rs 1000 Vajdo phone pay me sir",2,0,2026-03-22T14:50:12Z,main toh apka big fan hu sir but kya kare nhi toh gift iphone mila aaj mujhe rs 1000 vajdo phone pay me sir,0.0,neutral,0
vF6zX_NGYts,Itne saal bad Aya notification aapka video ka....❤,1,0,2026-03-22T14:49:00Z,itne saal bad aya notification aapka video ka,-0.5,negative,1
vF6zX_NGYts,Thank you so much sir I alays like your video love you ❤❤❤,1,0,2026-03-22T14:48:34Z,thank you so much sir i alays like your video love you,0.5,positive,0
vF6zX_NGYts,"Namaskar Guruji, Galaxy Buds 3PRO Rs. 12000, can I purchase?",0,1,2026-03-22T14:48:19Z,namaskar guruji galaxy buds 3pro rs 12000 can i purchase,0.0,neutral,0
vF6zX_NGYts,Awesome 😎😎,0,0,2026-03-22T14:47:58Z,awesome,0.5,positive,0
vF6zX_NGYts,Bhakt hai ye bhi,0,0,2026-03-22T14:47:07Z,bhakt hai ye bhi,0.0,neutral,0
vF6zX_NGYts,NYC 🎉❤,0,0,2026-03-22T14:46:08Z,nyc,0.0,neutral,0
vF6zX_NGYts,Movie aisi bano ki tech wale log bhi review kare,3,0,2026-03-22T14:45:35Z,movie aisi bano ki tech wale log bhi review kare,0.0,neutral,0
vF6zX_NGYts,#bologuruji snapdragon x2 wale laptop kab India me aayenge,0,0,2026-03-22T14:45:00Z,bologuruji snapdragon x2 wale laptop kab india me aayenge,0.0,neutral,0
vF6zX_NGYts,Guruji during sex chliya suru krte h😂😂,0,0,2026-03-22T14:41:30Z,guruji during sex chliya suru krte h,0.0,neutral,0
vF6zX_NGYts,😊 bhai me aapki sab video dekhta hu aur kayui salo se subscribe kiya hai aap ek iphone give avay karddo pls7,0,0,2026-03-22T14:40:49Z,bhai me aapki sab video dekhta hu aur kayui salo se subscribe kiya hai aap ek iphone give avay karddo pls7,0.0,neutral,0
vF6zX_NGYts,This like for dhurandhar 2 review 👍👍👍👍,6,0,2026-03-22T14:38:47Z,this like for dhurandhar 2 review,0.0,neutral,0
vF6zX_NGYts,"Technical guruji ✅
Filmy guruji ✅",0,0,2026-03-22T14:38:40Z,technical guruji filmy guruji,0.0,neutral,0
vF6zX_NGYts,"#bologuruji hello Gaurav guruji bro main truck lover & bus lover fan hun mujhe bade heavy commercial vehicles trucks & buses se pyar hai mujhe truck aur bus mein bahut jyada interest hai main trucks or buses ke bare mein nai nai jankariyan leta rehta hun, mere ko truck aur bus ki photo video lena aur inke sath photo khinchvana bahut achcha lagta hai main WhatsApp per bhi bus or truck ke status dalta hun main apne YouTube channel per trucks & buses ki videos ka content banata hun, mujhe bus mein journey karna bahut pasand hai bahut achcha lagta hai bus mein super luxury feel aata hai bus mein safar karne ka bhi apna hi alag maja hai, hamare Himachal ki pahadon ki rani pahadon ki shaan hamari lifeline HRTC govt. buses & pvt. buses hai bus ke staff driver conductor apne ghar parivar se dur rehkar din raat mehnat karke khatarnak sadkon per bus chala ke paise kama rahe hai aur ham जनता logon ko apni सेवाएं de rahe hai (respect all drivers & conductors)👑😎 I❤️bus I always travel with buses🔥🔥🔥🥰😍🤩🧡🤍💚",1,0,2026-03-22T14:38:23Z,bologuruji hello gaurav guruji bro main truck lover bus lover fan hun mujhe bade heavy commercial vehicles trucks buses se pyar hai mujhe truck aur bus mein bahut jyada interest hai main trucks or buses ke bare mein nai nai jankariyan leta rehta hun mere ko truck aur bus ki photo video lena aur inke sath photo khinchvana bahut achcha lagta hai main whatsapp per bhi bus or truck ke status dalta hun main apne youtube channel per trucks buses ki videos ka content banata hun mujhe bus mein journey karna bahut pasand hai bahut achcha lagta hai bus mein super luxury feel aata hai bus mein safar karne ka bhi apna hi alag maja hai hamare himachal ki pahadon ki rani pahadon ki shaan hamari lifeline hrtc govt buses pvt buses hai bus ke staff driver conductor apne ghar parivar se dur rehkar din raat mehnat karke khatarnak sadkon per bus chala ke paise kama rahe hai aur ham logon ko apni de rahe hai respect all drivers conductors i bus i always travel with buses,0.0,neutral,1
vF6zX_NGYts,8:17  bjp  ajent 😂,1,2,2026-03-22T14:37:43Z,8 17 bjp ajent,0.0,neutral,0
vF6zX_NGYts,Mzaa aa gya,0,0,2026-03-22T14:36:42Z,mzaa aa gya,0.0,neutral,0
vF6zX_NGYts,Dhurandhar 2 Me I am ready ready 🤫,1,0,2026-03-22T14:36:34Z,dhurandhar 2 me i am ready ready,0.0,neutral,1
vF6zX_NGYts,AB LOG PROPAGANDA BOLENGE😂,1,1,2026-03-22T14:36:31Z,ab log propaganda bolenge,0.0,neutral,0
vF6zX_NGYts,Nearly 7 saal baad notification aaya ur 7 saal baad hi ye channel ka video dekhra hu,2,0,2026-03-22T14:36:24Z,nearly 7 saal baad notification aaya ur 7 saal baad hi ye channel ka video dekhra hu,0.0,neutral,1
vF6zX_NGYts,give  me free iphone 17 pro max plz bhai,0,0,2026-03-22T14:36:17Z,give me free iphone 17 pro max plz bhai,0.0,neutral,0
vF6zX_NGYts,Galat line me aa gaye 😅😅,0,0,2026-03-22T14:36:17Z,galat line me aa gaye,0.0,neutral,0
vF6zX_NGYts,15 comment,0,0,2026-03-22T14:36:09Z,15 comment,0.0,neutral,0
vF6zX_NGYts,Why the video quality is too low in 4k .. camera issue,0,0,2026-03-22T14:36:00Z,why the video quality is too low in 4k camera issue,0.0,neutral,0
vF6zX_NGYts,Kitna faltu tym h apke pass,0,0,2026-03-22T14:35:52Z,kitna faltu tym h apke pass,0.0,neutral,0
vF6zX_NGYts,Bjp ki documentary 😂,1,0,2026-03-22T14:35:40Z,bjp ki documentary,0.0,neutral,0
vF6zX_NGYts,Dhurandhar title mein dekh ke aa gaya,2,0,2026-03-22T14:35:37Z,dhurandhar title mein dekh ke aa gaya,0.0,neutral,0
wWRNobND7Yo,Jaldi se LIKE aur SHARE kardo #TGFamily!!!,34,9,2026-03-21T12:32:33Z,jaldi se like aur share kardo tgfamily,0.0,neutral,0
wWRNobND7Yo,"""Sir, main ek chote se gaon se hoon aur filhal apni 12th ki padhai ke saath-saath mehnat kar raha hoon taaki apne pairon par khada ho sakun. Mere paas bada phone lene ke paise toh nahi hain, par bade sapne zaroor hain. Agar ye mil jata hai toh meri padhai aur kaam mein bahut badi madad ho jayegi. Aapka kaam dekh kar hamesha himmat milti hai. #tecnical guruji",0,0,2026-03-22T14:26:35Z,sir main ek chote se gaon se hoon aur filhal apni 12th ki padhai ke saath saath mehnat kar raha hoon taaki apne pairon par khada ho sakun mere paas bada phone lene ke paise toh nahi hain par bade sapne zaroor hain agar ye mil jata hai toh meri padhai aur kaam mein bahut badi madad ho jayegi aapka kaam dekh kar hamesha himmat milti hai tecnical guruji,-0.5,negative,1
wWRNobND7Yo,C2 ka haircut rate kro 🙂,0,0,2026-03-22T14:11:31Z,c2 ka haircut rate kro,0.0,neutral,0
wWRNobND7Yo,Me to oneplus nord 6 ke liye excited hu bro or mujhe lag raha hai oneplus nord 4 ka metal body la sakta hai nord 6 me ❤😍 kyuki unhone pucha hai x per ki aapko nord 4 ka design kaisa lagta hai to iska matlab ye hi hua ki wo metal body phirse lane ki souch rahe hai or agar jyada user's ne bola ha pasand hai to nord 6 me metal body asakti hai ❤😊 maine to boldiya ❤ guys tum bhi boldo 🙏,1,0,2026-03-22T11:29:35Z,me to oneplus nord 6 ke liye excited hu bro or mujhe lag raha hai oneplus nord 4 ka metal body la sakta hai nord 6 me kyuki unhone pucha hai x per ki aapko nord 4 ka design kaisa lagta hai to iska matlab ye hi hua ki wo metal body phirse lane ki souch rahe hai or agar jyada user s ne bola ha pasand hai to nord 6 me metal body asakti hai maine to boldiya guys tum bhi boldo,0.0,neutral,1
wWRNobND7Yo,Super videos 🎉❤❤🎉🎉,1,0,2026-03-22T09:38:52Z,super videos,0.0,neutral,0
wWRNobND7Yo,Audio is poor 👎👎👎,1,0,2026-03-22T08:47:21Z,audio is poor,0.0,neutral,0
wWRNobND7Yo,S A R  NOT  E N G  PLESS  HINDI,1,0,2026-03-22T08:00:40Z,s a r not e n g pless hindi,0.0,neutral,0
wWRNobND7Yo,"CAN YOU MAKE A FULL VIDEO TO SHOW TO YOUR YOUTUBE FAMILY MEMBERS / FANS HOW THEY CAN ALSO GET PHONES AND OTHER TECH STUFF WHICH ARE NOT AVAILABLE IN INDIA AND WHICH WON'T BE COMING IN INDIA.

ALSO CAN YOU TELL YOUR YOUTUBE FAMILY MEMBERS / FANS THE PROS. AND CONS. OF PURCHASING STUFF FROM OTHER CONTRIES.

ALSO CAN YOU PLEASE TELL US HOW MUCH DOES IT COSTS (APPROXIMATELY) FOR DELIVERY / DELIVERY CHARGES.",0,0,2026-03-22T07:32:01Z,can you make a full video to show to your youtube family members fans how they can also get phones and other tech stuff which are not available in india and which won t be coming in india also can you tell your youtube family members fans the pros and cons of purchasing stuff from other contries also can you please tell us how much does it costs approximately for delivery delivery charges,0.0,neutral,0
wWRNobND7Yo,kounse jungle ke resort mai baithe ho guruji...😂,0,0,2026-03-22T06:14:34Z,kounse jungle ke resort mai baithe ho guruji,0.0,neutral,0
wWRNobND7Yo,#Bologuruji #BOLOGURUJI #bologuruji I want to meet you bhai plssss it's very important pls 🙏,1,1,2026-03-22T04:08:03Z,bologuruji bologuruji bologuruji i want to meet you bhai plssss it s very important pls,0.0,neutral,0
wWRNobND7Yo,29 march 2026  Samsung a57 & a37  Lunch hone wale hai,0,1,2026-03-22T03:39:37Z,29 march 2026 samsung a57 a37 lunch hone wale hai,0.0,neutral,0
wWRNobND7Yo,Informative video,1,1,2026-03-22T03:34:33Z,informative video,0.0,neutral,0
wWRNobND7Yo,Jai Shree Krishna.,0,0,2026-03-22T03:25:21Z,jai shree krishna,0.0,neutral,0
wWRNobND7Yo,Md Siraj 😂😂,0,0,2026-03-21T17:03:00Z,md siraj,0.0,neutral,0
wWRNobND7Yo,Realme neo 8 kab tak ayega ?,0,0,2026-03-21T16:31:02Z,realme neo 8 kab tak ayega,0.0,neutral,0
wWRNobND7Yo,Plus key गायब है nord 6,0,0,2026-03-21T16:24:52Z,plus key nord 6,0.0,neutral,0
wWRNobND7Yo,Bhai CMF 3 ki koi news?,0,0,2026-03-21T16:15:14Z,bhai cmf 3 ki koi news,0.0,neutral,0
wWRNobND7Yo,"OnePlus Nord 6, Xiaomi 18 Pro, Starlink",0,0,2026-03-21T15:59:03Z,oneplus nord 6 xiaomi 18 pro starlink,0.0,neutral,0
wWRNobND7Yo,guru G WTF Name change kro bda ajib lgta hai. Mtlb kuch bhi ho WTF Dekh k hi skip Krne ka mn krta hai.vaise apko sunte sunte muje 8 saal s jyada ho gaye honge.thanks!,1,0,2026-03-21T15:14:05Z,guru g wtf name change kro bda ajib lgta hai mtlb kuch bhi ho wtf dekh k hi skip krne ka mn krta hai vaise apko sunte sunte muje 8 saal s jyada ho gaye honge thanks,0.0,neutral,1
wWRNobND7Yo,"#bologuruji
Poco m8 vs iQOO z11x",7,0,2026-03-21T14:56:42Z,bologuruji poco m8 vs iqoo z11x,0.0,neutral,0
wWRNobND7Yo,Please batayiye ipad 12th kab release hoga aur kb hoga Please acche se batayiyena. Hm kafi time se wait krte krte thk gye hai😢,2,0,2026-03-21T14:48:54Z,please batayiye ipad 12th kab release hoga aur kb hoga please acche se batayiyena hm kafi time se wait krte krte thk gye hai,0.0,neutral,1
wWRNobND7Yo,Bro i have watched your videos daily iam big fan of you from kashmir plz i phone15pro max giveway kro na mughe love from kashmir❤,1,1,2026-03-21T14:42:25Z,bro i have watched your videos daily iam big fan of you from kashmir plz i phone15pro max giveway kro na mughe love from kashmir,0.5,positive,0
wWRNobND7Yo,Amazing Tech News Brother ❤️🔥👌,2,1,2026-03-21T14:40:51Z,amazing tech news brother,0.5,positive,0
wWRNobND7Yo,Vivo t4 ultra ki performance or stability wagera kaisa hai agr same range me isse best option hai toh btao,0,0,2026-03-21T14:29:31Z,vivo t4 ultra ki performance or stability wagera kaisa hai agr same range me isse best option hai toh btao,0.0,neutral,1
wWRNobND7Yo,Will together launch or not one plus nord 6 and nord ce 6,0,0,2026-03-21T14:29:03Z,will together launch or not one plus nord 6 and nord ce 6,0.0,neutral,0
wWRNobND7Yo,"120 hz ❌
90hz ✅",0,0,2026-03-21T14:18:29Z,120 hz 90hz,0.0,neutral,0
wWRNobND7Yo,Mota bezle hoga aur kya,0,0,2026-03-21T14:09:57Z,mota bezle hoga aur kya,0.0,neutral,0
wWRNobND7Yo,Moto edge 70 pro kadhi yenar?,0,0,2026-03-21T14:01:37Z,moto edge 70 pro kadhi yenar,0.0,neutral,1
wWRNobND7Yo,*Kya koi bta sakta hai oneplus 15T kab tak launch hoga* ❤❤❤❤,0,0,2026-03-21T13:52:26Z,kya koi bta sakta hai oneplus 15t kab tak launch hoga,0.0,neutral,0
wWRNobND7Yo,🌥️🏡🌙🌌🕊️🐦🌳🌺☀️🌤️Happy vernal equinox in northern hemisphere,0,0,2026-03-21T13:40:29Z,happy vernal equinox in northern hemisphere,0.0,neutral,0
wWRNobND7Yo,Nice video sir ji🎉🎉🎉🎉🎉,0,0,2026-03-21T13:33:10Z,nice video sir ji,0.5,positive,0
wWRNobND7Yo,Guruji Jawan ho gaye hain 😂,0,1,2026-03-21T13:24:09Z,guruji jawan ho gaye hain,0.0,neutral,0
wWRNobND7Yo,"When will oneplus nord ce6 launch?
Will it launch nord 6 or later ?",0,0,2026-03-21T13:23:09Z,when will oneplus nord ce6 launch will it launch nord 6 or later,0.0,neutral,0
wWRNobND7Yo,Downfall technical guruji 📉🧠👨‍💻🤔,1,1,2026-03-21T13:22:23Z,downfall technical guruji,0.0,neutral,0
wWRNobND7Yo,"Namaste Sir, mera naam Aryan Baggarwal hai aur main Haridwar se hoon. Main programming, AI aur cybersecurity padhna chahta hoon lekin meri family abhi laptop afford nahi kar paa rahi; agar aap meri study ke liye help kar sakein to main bahut mehnat karke aage badhna chahta hoon.Sir chaho to aap bad me jab me paise kamane lag jauga tab mere se aap paise le Lena laptop ke sir bahut jarurat hai study ke liye",0,0,2026-03-21T13:14:24Z,namaste sir mera naam aryan baggarwal hai aur main haridwar se hoon main programming ai aur cybersecurity padhna chahta hoon lekin meri family abhi laptop afford nahi kar paa rahi agar aap meri study ke liye help kar sakein to main bahut mehnat karke aage badhna chahta hoon sir chaho to aap bad me jab me paise kamane lag jauga tab mere se aap paise le lena laptop ke sir bahut jarurat hai study ke liye,-0.5,negative,1
wWRNobND7Yo,Bhai apke hair cut ka naam kya he ✂️,0,0,2026-03-21T13:12:00Z,bhai apke hair cut ka naam kya he,0.0,neutral,0
wWRNobND7Yo,Technical guruji 👍🏻,0,0,2026-03-21T13:05:47Z,technical guruji,0.0,neutral,0
wWRNobND7Yo,"Vai Which one Should i go for Second Hand.... Store
1. Samsung galaxy S25 Ultra... 
Or 2. iPhone 16 pro max....
While buying second hand iPhone and Samsung What Should We must have to Check And inspect.... #bologuruji.....",0,0,2026-03-21T13:03:55Z,vai which one should i go for second hand store 1 samsung galaxy s25 ultra or 2 iphone 16 pro max while buying second hand iphone and samsung what should we must have to check and inspect bologuruji,0.0,neutral,0
wWRNobND7Yo,Sir ji s24 ultra kaise rahega lena 2026 me please sahi btana,0,0,2026-03-21T12:55:35Z,sir ji s24 ultra kaise rahega lena 2026 me please sahi btana,0.0,neutral,0
wWRNobND7Yo,Will iQOO neo 11 launched in India??,0,0,2026-03-21T12:53:50Z,will iqoo neo 11 launched in india,0.0,neutral,0
wWRNobND7Yo,"Hello sir 
 help . I am a student of hotel management  
I need your help my phone was broken i don't have any source to buy a new phone 
My 50% work in my phone 📱 I need a new phone this is my email i will give you my mobile number for all details. Thanks for seeing my message. 🙏🙏🙏🙏🙏🙏",0,0,2026-03-21T12:52:21Z,hello sir help i am a student of hotel management i need your help my phone was broken i don t have any source to buy a new phone my 50 work in my phone i need a new phone this is my email i will give you my mobile number for all details thanks for seeing my message,0.0,neutral,0
wWRNobND7Yo,Waiting for Oneplus nord 6,0,1,2026-03-21T12:48:35Z,waiting for oneplus nord 6,0.0,neutral,0
wWRNobND7Yo,"Guruji UAE Se India Chle aye 😂😂😂
Dar ka mahol",0,0,2026-03-21T12:45:34Z,guruji uae se india chle aye dar ka mahol,0.0,neutral,0
wWRNobND7Yo,My birthday is right after your birthday—on 8 may😅😊😊,0,0,2026-03-21T12:43:36Z,my birthday is right after your birthday on 8 may,0.0,neutral,0
jS1jMLK9VAg,Faltu ka cheez hai,0,0,2026-03-22T07:54:34Z,faltu ka cheez hai,0.0,neutral,0
jS1jMLK9VAg,kuch kam ka nahi faltu mey,0,0,2026-03-22T07:17:12Z,kuch kam ka nahi faltu mey,0.0,neutral,0
jS1jMLK9VAg,"Tik tok,pubg ban news 
Aaj kya ho gaya aapka",0,0,2026-03-22T05:26:02Z,tik tok pubg ban news aaj kya ho gaya aapka,0.0,neutral,0
jS1jMLK9VAg,#Bologuruji #BOLOGURUJI #bologuruji I want to meet you guruji pls 🙏 it's very important pls 🙏,1,0,2026-03-22T01:00:56Z,bologuruji bologuruji bologuruji i want to meet you guruji pls it s very important pls,0.0,neutral,0
jS1jMLK9VAg,Paisa hain udate raho...,0,0,2026-03-21T21:52:11Z,paisa hain udate raho,0.0,neutral,0
jS1jMLK9VAg,Kese ho garibo chliye shuru krte hai😂😂😂🙏🏻,1,0,2026-03-21T21:24:12Z,kese ho garibo chliye shuru krte hai,0.0,neutral,0
jS1jMLK9VAg,"These are useless in evening, nobody wears sunglasses in the evening. People will laugh.",0,0,2026-03-21T20:35:33Z,these are useless in evening nobody wears sunglasses in the evening people will laugh,0.0,neutral,0
jS1jMLK9VAg,11 minute ki aisi tesi kar di is se kya kya hoga bataya tak nhi,0,0,2026-03-21T17:19:00Z,11 minute ki aisi tesi kar di is se kya kya hoga bataya tak nhi,0.0,neutral,0
jS1jMLK9VAg,Mere kisi kaam ka nahin ha❤❤😂,0,0,2026-03-21T10:50:59Z,mere kisi kaam ka nahin ha,0.0,neutral,0
jS1jMLK9VAg,2:29 These are the glasses 😂😂😂? Fucking anything 😂,0,0,2026-03-21T07:06:23Z,2 29 these are the glasses fucking anything,0.0,neutral,0
jS1jMLK9VAg,You look like virat kohali when Wearing this,0,0,2026-03-21T04:02:07Z,you look like virat kohali when wearing this,0.0,neutral,0
jS1jMLK9VAg,Jai Shree Krishna.,0,0,2026-03-21T03:50:39Z,jai shree krishna,0.0,neutral,0
jS1jMLK9VAg,Nice One Brother ❤️🔥👌,1,0,2026-03-21T03:04:11Z,nice one brother,0.5,positive,0
jS1jMLK9VAg,"Namaste Sir, mera naam Aryan Baggarwal hai aur main Haridwar se hoon. Main programming, AI aur cybersecurity padhna chahta hoon lekin meri family abhi laptop afford nahi kar paa rahi; agar aap meri study ke liye help kar sakein to main bahut mehnat karke aage badhna chahta hoon.Sir chaho to aap bad me jab me paise kamane lag jauga tab mere se aap paise le Lena laptop ke sir bahut jarurat hai study ke liye",0,2,2026-03-21T02:59:08Z,namaste sir mera naam aryan baggarwal hai aur main haridwar se hoon main programming ai aur cybersecurity padhna chahta hoon lekin meri family abhi laptop afford nahi kar paa rahi agar aap meri study ke liye help kar sakein to main bahut mehnat karke aage badhna chahta hoon sir chaho to aap bad me jab me paise kamane lag jauga tab mere se aap paise le lena laptop ke sir bahut jarurat hai study ke liye,-0.5,negative,1
jS1jMLK9VAg,It’s available in UAE please visit Al Amin Opticals,0,0,2026-03-20T20:18:53Z,it s available in uae please visit al amin opticals,0.0,neutral,0
jS1jMLK9VAg,Mata Ai 💪💪💪,1,0,2026-03-20T19:21:23Z,mata ai,0.0,neutral,0
jS1jMLK9VAg,guruji picked gold kyuki unki cornea me bhi sona hai💸💸💸. gareebooooo.....,0,0,2026-03-20T17:32:30Z,guruji picked gold kyuki unki cornea me bhi sona hai gareebooooo,0.0,neutral,0
