video_id,comment_text,likes,replies,comment_published_at,clean_comment,sentiment_score,sentiment_label,disengagement_keyword_flag
jS1jMLK9VAg,"Hello sir I really need your help . I am a student of hotel management  
I need your help my phone was broken i don't have any source to buy a new phone 
My 50% work in my phone 📱 I need a new phone this is my email i will give you my mobile number for all details. Thanks for seeing my message. 🙏🙏🙏🙏🙏🙏",1,0,2026-03-20T16:39:20Z,hello sir i really need your help i am a student of hotel management i need your help my phone was broken i don t have any source to buy a new phone my 50 work in my phone i need a new phone this is my email i will give you my mobile number for all details thanks for seeing my message,0.0,neutral,0
jS1jMLK9VAg,"Hello sir I really need your help . I am a student of hotel management  
I need your help my phone was broken i don't have any source to buy a new phone 
My 50% work in my phone 📱 I need a new phone this is my email i will give you my mobile number for all details. Thanks for seeing my message. 🙏🙏🙏🙏🙏🙏",1,0,2026-03-20T16:38:59Z,hello sir i really need your help i am a student of hotel management i need your help my phone was broken i don t have any source to buy a new phone my 50 work in my phone i need a new phone this is my email i will give you my mobile number for all details thanks for seeing my message,0.0,neutral,0
jS1jMLK9VAg,Pls guru ji ek phone  dila do na pls guru ji bas ek phone  mera pas paise nahi hai guru ji pls ek phone youtube videos banana chahata hun pls guru ji 😢😢,0,0,2026-03-20T16:29:37Z,pls guru ji ek phone dila do na pls guru ji bas ek phone mera pas paise nahi hai guru ji pls ek phone youtube videos banana chahata hun pls guru ji,0.0,neutral,0
jS1jMLK9VAg,Guru ji ek phone dila do naa pls,0,0,2026-03-20T16:23:59Z,guru ji ek phone dila do naa pls,0.0,neutral,0
jS1jMLK9VAg,Meta ka naam beta rakh lo,0,0,2026-03-20T16:21:09Z,meta ka naam beta rakh lo,0.0,neutral,0
jS1jMLK9VAg,Gold wala kyu choose Kiya sach sach batao bhai 😂😂😂😂,0,0,2026-03-20T16:19:19Z,gold wala kyu choose kiya sach sach batao bhai,0.0,neutral,0
jS1jMLK9VAg,Nice,0,0,2026-03-20T15:17:12Z,nice,0.5,positive,0
jS1jMLK9VAg,Hey Betaa ❌ Le Betaaa ✅ 😂😂😂,2,0,2026-03-20T15:07:42Z,hey betaa le betaaa,0.0,neutral,0
jS1jMLK9VAg,*MasT Motaa Bhai* .. 👌🏿,0,0,2026-03-20T15:07:13Z,mast motaa bhai,0.0,neutral,0
jS1jMLK9VAg,Pagal banna ho to iske vedio dekho thik,0,0,2026-03-20T15:01:55Z,pagal banna ho to iske vedio dekho thik,0.0,neutral,0
jS1jMLK9VAg,Ase hi video dekhne ke lia ye chanel dekhe❤❤❤❤,1,0,2026-03-20T15:01:10Z,ase hi video dekhne ke lia ye chanel dekhe,0.0,neutral,0
jS1jMLK9VAg,CHASMA FROM #US CHADDI FROM DUBAI ❤,0,0,2026-03-20T14:45:49Z,chasma from us chaddi from dubai,0.0,neutral,1
jS1jMLK9VAg,My friend you,0,0,2026-03-20T14:42:19Z,my friend you,0.0,neutral,0
jS1jMLK9VAg,Nu di ty le nc e😊,1,0,2026-03-20T14:24:17Z,nu di ty le nc e,0.0,neutral,0
jS1jMLK9VAg,"Werables are now becoming a spying tool for hackers ..  Be extremely careful with these gadgets ... Do not use them in your private time ... Smart watch, smart eye wear, everything is and can be tracked and hacked",14,0,2026-03-20T14:22:16Z,werables are now becoming a spying tool for hackers be extremely careful with these gadgets do not use them in your private time smart watch smart eye wear everything is and can be tracked and hacked,0.0,neutral,1
jS1jMLK9VAg,The downfall of the technical guruji 📉🤔,0,0,2026-03-20T14:19:40Z,the downfall of the technical guruji,0.0,neutral,0
jS1jMLK9VAg,"While you were trying this Glass you just resemble Virat Kohli, just look alike",1,0,2026-03-20T14:08:28Z,while you were trying this glass you just resemble virat kohli just look alike,0.0,neutral,0
jS1jMLK9VAg,Technical guruji 👍🏻,2,0,2026-03-20T13:56:45Z,technical guruji,0.0,neutral,0
jS1jMLK9VAg,😂😂 Technical Guruji ka to end ho gaya,3,0,2026-03-20T13:45:23Z,technical guruji ka to end ho gaya,0.0,neutral,0
jS1jMLK9VAg,Im waiting for Samsung glasses❤🎉,0,0,2026-03-20T12:57:15Z,im waiting for samsung glasses,0.0,neutral,0
jS1jMLK9VAg,Sir 🎉🎉🎉🎉🎉🎉🎉🎉🎉🎉 kuch ni lena,0,0,2026-03-20T12:48:56Z,sir kuch ni lena,0.0,neutral,0
jS1jMLK9VAg,Integration of Meta AI with Oakley’s design is impressive. Love the detailed walkthrough of the features💯🔥🔥,2,0,2026-03-20T12:41:54Z,integration of meta ai with oakley s design is impressive love the detailed walkthrough of the features,0.5,positive,0
jS1jMLK9VAg,Gareebo😂😂,1,0,2026-03-20T12:41:25Z,gareebo,0.0,neutral,0
jS1jMLK9VAg,yo,0,0,2026-03-20T12:38:09Z,yo,0.0,neutral,0
jS1jMLK9VAg,इतना महेगा मेरी बस की नही है मे साईकल से ठीक हु😊 no मनी नो हानि,0,0,2026-03-20T12:35:38Z,no,0.0,neutral,0
jS1jMLK9VAg,Vlog shoot karte time Camera apne aap back kyu ho jata hai,1,0,2026-03-20T12:32:35Z,vlog shoot karte time camera apne aap back kyu ho jata hai,0.0,neutral,0
6I-EI8TNZAg,"The Glyphs light 🚨 are gone forever

It's been 4 version of Nothing but the phone doesn't have IP 68/69 rating and Snapdragon 8 gen Chips",0,0,2026-03-22T10:16:35Z,the glyphs light are gone forever it s been 4 version of nothing but the phone doesn t have ip 68 69 rating and snapdragon 8 gen chips,0.0,neutral,0
6I-EI8TNZAg,Hlo gaurav bhai i am currently using S25 ultra and i am a tech enthusiast. So what are ypur insight in shifting from S25 ultra to Nothing 4a pro #bologuruji #technicalguruji,0,0,2026-03-22T08:53:41Z,hlo gaurav bhai i am currently using s25 ultra and i am a tech enthusiast so what are ypur insight in shifting from s25 ultra to nothing 4a pro bologuruji technicalguruji,0.0,neutral,0
6I-EI8TNZAg,"I think u don't put any effort in review nowadays... There are no insights... It's just plain reading of specs and all...  The novelty factor has just worn off... 
Do think about it!",1,0,2026-03-22T05:08:54Z,i think u don t put any effort in review nowadays there are no insights it s just plain reading of specs and all the novelty factor has just worn off do think about it,0.0,neutral,1
6I-EI8TNZAg,Nothing like retro style ui os pixel game unic diffrent where servise center,1,0,2026-03-22T03:16:36Z,nothing like retro style ui os pixel game unic diffrent where servise center,0.0,neutral,0
6I-EI8TNZAg,Processor wrong in the video redit it,0,0,2026-03-22T02:46:29Z,processor wrong in the video redit it,0.0,neutral,0
6I-EI8TNZAg,Dada video mai displayed ho raha hai 7sgen 4 plz edit with 7gen4,0,0,2026-03-21T19:27:08Z,dada video mai displayed ho raha hai 7sgen 4 plz edit with 7gen4,0.0,neutral,1
6I-EI8TNZAg,Moto is best camera better than is camera,0,0,2026-03-21T18:26:26Z,moto is best camera better than is camera,0.5,positive,0
6I-EI8TNZAg,#chota tha tb  se apka video dekh rha sir but aap apne fan se milte nai Mera shapna hai main apse milu Orr aap muje eek phone gift kro,0,0,2026-03-21T18:18:20Z,chota tha tb se apka video dekh rha sir but aap apne fan se milte nai mera shapna hai main apse milu orr aap muje eek phone gift kro,0.0,neutral,0
6I-EI8TNZAg,Giftwye me paji,0,0,2026-03-21T17:46:53Z,giftwye me paji,0.0,neutral,0
6I-EI8TNZAg,Sir 1 phone chye muje please send me,0,0,2026-03-21T16:32:44Z,sir 1 phone chye muje please send me,0.0,neutral,0
6I-EI8TNZAg,"Donate kardo koi please 4-5k wala phone for study purpose dharmendra.s4ptaxis
.s4 ke baad @ laga lena pls 🙏🏿",0,0,2026-03-21T06:13:27Z,donate kardo koi please 4 5k wala phone for study purpose dharmendra s4ptaxis s4 ke baad laga lena pls,0.0,neutral,1
6I-EI8TNZAg,Nothing is giving nothing except design 😅,1,0,2026-03-20T20:23:02Z,nothing is giving nothing except design,0.0,neutral,0
6I-EI8TNZAg,Best Camera Phones Under 25000 in 2026: Comparison Video make it,0,0,2026-03-20T16:37:18Z,best camera phones under 25000 in 2026 comparison video make it,0.5,positive,0
6I-EI8TNZAg,Good 👍,0,0,2026-03-20T15:21:10Z,good,0.5,positive,0
6I-EI8TNZAg,Technical guruji 👍🏻,0,0,2026-03-20T13:55:49Z,technical guruji,0.0,neutral,0
6I-EI8TNZAg,13:38 tu use krega Aur wo bhi nothing..! chal ja re Apple ke chode😂,0,0,2026-03-20T12:02:20Z,13 38 tu use krega aur wo bhi nothing chal ja re apple ke chode,0.0,neutral,0
6I-EI8TNZAg,12:13 Abe yeh time baki phone me bhi dekh skte hai always on display on krke ... bina phone ko uthaye.... Khuch. bhi. bolta hai sala... kitne paise diye hai nothing ne😂,0,0,2026-03-20T11:59:21Z,12 13 abe yeh time baki phone me bhi dekh skte hai always on display on krke bina phone ko uthaye khuch bhi bolta hai sala kitne paise diye hai nothing ne,0.0,neutral,0
6I-EI8TNZAg,Bhai apple store pe job kese mile sakti h uski full details pe video bnao please,0,0,2026-03-20T11:42:59Z,bhai apple store pe job kese mile sakti h uski full details pe video bnao please,0.0,neutral,0
6I-EI8TNZAg,"#bologuruji sir mujhe apne mummy ke liye smartphone lena hai, toh moto g96 and poco m8 mein se kaunsa better hoga, in terms of durability and long lasting time Tak, taaki minimum 5 years tak chal jaye ?",0,1,2026-03-20T11:12:00Z,bologuruji sir mujhe apne mummy ke liye smartphone lena hai toh moto g96 and poco m8 mein se kaunsa better hoga in terms of durability and long lasting time tak taaki minimum 5 years tak chal jaye,0.0,neutral,0
6I-EI8TNZAg,Nice,0,0,2026-03-20T10:56:49Z,nice,0.5,positive,0
6I-EI8TNZAg,Super phn h sach mei❤,0,0,2026-03-20T10:51:53Z,super phn h sach mei,0.0,neutral,0
6I-EI8TNZAg,Bhaad mein jao guruji ap se pahle air aacha review bahut koi de gaya,0,0,2026-03-20T09:39:56Z,bhaad mein jao guruji ap se pahle air aacha review bahut koi de gaya,0.0,neutral,1
6I-EI8TNZAg,"Namaste Sir, mera naam Aryan Baggarwal hai aur main Haridwar se hoon. Main programming, AI aur cybersecurity padhna chahta hoon lekin meri family abhi laptop afford nahi kar paa rahi; agar aap meri study ke liye help kar sakein to main bahut mehnat karke aage badhna chahta hoon.Sir chaho to aap bad me jab me paise kamane lag jauga tab mere se aap paise le Lena laptop ke sir bahut jarurat hai study ke liye",1,0,2026-03-20T09:22:23Z,namaste sir mera naam aryan baggarwal hai aur main haridwar se hoon main programming ai aur cybersecurity padhna chahta hoon lekin meri family abhi laptop afford nahi kar paa rahi agar aap meri study ke liye help kar sakein to main bahut mehnat karke aage badhna chahta hoon sir chaho to aap bad me jab me paise kamane lag jauga tab mere se aap paise le lena laptop ke sir bahut jarurat hai study ke liye,-0.5,negative,1
6I-EI8TNZAg,Guru ji aap ka video bhot time s dekh ta hu par aj tak aap n mobile gift nhi kiya 😢😢😢😢,0,0,2026-03-20T09:12:53Z,guru ji aap ka video bhot time s dekh ta hu par aj tak aap n mobile gift nhi kiya,0.0,neutral,0
6I-EI8TNZAg,"7000 mah battery Dena chahie thi. 
80 watt ka fast charger Dena chahie tha. 
6 sal ke Android update Dena chahie the. 
Yah phone 22000 mein direct cash on delivery Dena chahie tha.",1,1,2026-03-20T06:52:51Z,7000 mah battery dena chahie thi 80 watt ka fast charger dena chahie tha 6 sal ke android update dena chahie the yah phone 22000 mein direct cash on delivery dena chahie tha,0.0,neutral,0
6I-EI8TNZAg,Box presentation is owsm 🔥,1,0,2026-03-20T06:11:03Z,box presentation is owsm,0.0,neutral,0
6I-EI8TNZAg,"GAURAV Sir,   
yah nothing phone sab kuchh To badhiya hai , per ismein bahut badi Kami h Mere liye. vah Hai iss phone ki battery.  

Kyunki Mera use bahut jyada hai mobile ka.  Bas battery hi mere liye deal Breaker hai.

 Nothing ko aaj ke date mein kam se kam 6000 MH  battery Dena Hi chahie tha      ......",0,0,2026-03-20T05:06:34Z,gaurav sir yah nothing phone sab kuchh to badhiya hai per ismein bahut badi kami h mere liye vah hai iss phone ki battery kyunki mera use bahut jyada hai mobile ka bas battery hi mere liye deal breaker hai nothing ko aaj ke date mein kam se kam 6000 mh battery dena hi chahie tha,-0.5,negative,1
6I-EI8TNZAg,Sr 2026 backpack,0,0,2026-03-20T05:04:02Z,sr 2026 backpack,0.0,neutral,0
6I-EI8TNZAg,Ek ek karke mene sabhi techyoutuber ki video dekhli nothing ke upar..😅,4,1,2026-03-20T02:58:14Z,ek ek karke mene sabhi techyoutuber ki video dekhli nothing ke upar,0.0,neutral,0
6I-EI8TNZAg,"CMF 65W charger should be compatible for this? I m planning to buy, can anyone guide which would be best?",0,0,2026-03-20T01:35:23Z,cmf 65w charger should be compatible for this i m planning to buy can anyone guide which would be best,0.5,positive,0
6I-EI8TNZAg,Guru ji waise bhi nothing ka phone best rahta hai aur nothing 4apro ki looking 👌,0,0,2026-03-19T23:09:16Z,guru ji waise bhi nothing ka phone best rahta hai aur nothing 4apro ki looking,0.5,positive,0
6I-EI8TNZAg,"Bhai seen ur video after 3 years.. Must say your Bulky look was much better with excellent screen presence.. Now you look a bit aged n weak.. Just a opinion bhai,😢🙏",1,0,2026-03-19T21:48:24Z,bhai seen ur video after 3 years must say your bulky look was much better with excellent screen presence now you look a bit aged n weak just a opinion bhai,0.5,positive,0
6I-EI8TNZAg,pura biased hai video from nothing collaboration -- option,1,0,2026-03-19T20:56:24Z,pura biased hai video from nothing collaboration option,0.0,neutral,0
6I-EI8TNZAg,Sir phone mein sab acha hai lekin processor and without charger kya 40k sense hai 256gb variant,0,0,2026-03-19T18:17:02Z,sir phone mein sab acha hai lekin processor and without charger kya 40k sense hai 256gb variant,0.0,neutral,0
6I-EI8TNZAg,Lgta hai guruji motorola se naraj hai🧐,0,0,2026-03-19T18:15:31Z,lgta hai guruji motorola se naraj hai,0.0,neutral,0
6I-EI8TNZAg,"Mast he fon, guruji ❤",0,1,2026-03-19T18:10:11Z,mast he fon guruji,0.0,neutral,0
6I-EI8TNZAg,Sir im Samsung fan ❤🎉,0,0,2026-03-19T17:59:36Z,sir im samsung fan,0.0,neutral,0
6I-EI8TNZAg,मुझे 25 मार्च को मिल जाएगा🎉,0,0,2026-03-19T17:59:31Z,25,0.0,neutral,0
6I-EI8TNZAg,channel gets boring day by day,0,0,2026-03-19T17:46:07Z,channel gets boring day by day,-0.5,negative,1
6I-EI8TNZAg,Hii sir,0,0,2026-03-19T17:31:01Z,hii sir,0.0,neutral,0
6I-EI8TNZAg,Does Nothing 4A pro India variant have NFC functionality,0,0,2026-03-19T17:06:26Z,does nothing 4a pro india variant have nfc functionality,0.5,positive,0
6I-EI8TNZAg,Nice One Brother ❤️🔥👌,2,0,2026-03-19T17:05:30Z,nice one brother,0.5,positive,0
6I-EI8TNZAg,In nothing 4a pro is it okay if i use realme supervooc 45w charger? Require your guidance on this.,1,1,2026-03-19T16:41:38Z,in nothing 4a pro is it okay if i use realme supervooc 45w charger require your guidance on this,0.0,neutral,0
6I-EI8TNZAg,Kindly make one comparison video of Nothing 4A and 4A Pro,1,0,2026-03-19T16:33:52Z,kindly make one comparison video of nothing 4a and 4a pro,0.0,neutral,0
6I-EI8TNZAg,Why no other companies except samsung gives smart pen with phone?,0,0,2026-03-19T16:33:00Z,why no other companies except samsung gives smart pen with phone,0.0,neutral,0
6I-EI8TNZAg,"Guru ji kehne ko hain app, kaise is ghatiya aur itne mehge phone ko promote kar sakte ho aisi company jo sirf price hype karna janti ho ....m",0,0,2026-03-19T16:27:34Z,guru ji kehne ko hain app kaise is ghatiya aur itne mehge phone ko promote kar sakte ho aisi company jo sirf price hype karna janti ho m,0.0,neutral,0
aJMxLPu9x_M,Jaldi se LIKE aur SHARE kardo #TGFamily!!!,31,5,2026-03-18T12:47:45Z,jaldi se like aur share kardo tgfamily,0.0,neutral,0
aJMxLPu9x_M,This mac neo never even come in my dream😢,0,0,2026-03-22T08:16:56Z,this mac neo never even come in my dream,0.0,neutral,0
aJMxLPu9x_M,Sir itne sare MacBook hai apke pass ek de do old hi de do 🙂🙄,0,0,2026-03-21T17:46:14Z,sir itne sare macbook hai apke pass ek de do old hi de do,0.0,neutral,0
aJMxLPu9x_M,Kisi ke pass hai MacBook chaye m2,0,0,2026-03-21T17:44:43Z,kisi ke pass hai macbook chaye m2,0.0,neutral,0
aJMxLPu9x_M,"as you have talked about windows vs macbook neo lets talk on this budget,
in 69,000 you can really buy some good gaming laptops and for a dev like me who also likes to play games windows in this budget is better choice it cant even run android studio without lags meanwhile my laptop which is victus i bought during offers runs it smoothly and dont about think gaming in apple laptops, for running these you need to buy higher end models, which is more than 1 Lakh price",0,0,2026-03-21T09:49:28Z,as you have talked about windows vs macbook neo lets talk on this budget in 69 000 you can really buy some good gaming laptops and for a dev like me who also likes to play games windows in this budget is better choice it cant even run android studio without lags meanwhile my laptop which is victus i bought during offers runs it smoothly and dont about think gaming in apple laptops for running these you need to buy higher end models which is more than 1 lakh price,0.5,positive,0
aJMxLPu9x_M,"Is it good for 2d animation 
Like scary pumpkin?",0,0,2026-03-21T03:21:01Z,is it good for 2d animation like scary pumpkin,0.5,positive,0
aJMxLPu9x_M,Is it good for light coding and trading purposes?,0,0,2026-03-20T16:54:44Z,is it good for light coding and trading purposes,0.5,positive,1
aJMxLPu9x_M,Can we do programming in Neo ? (Automation testing / Coding ),0,0,2026-03-20T15:28:53Z,can we do programming in neo automation testing coding,0.0,neutral,0
aJMxLPu9x_M,No backlit keyboard! Who came up with this genius idea? Akin to no cabin lights in cars. torch lekar baitho. Fail!,0,0,2026-03-20T14:44:12Z,no backlit keyboard who came up with this genius idea akin to no cabin lights in cars torch lekar baitho fail,0.0,neutral,0
aJMxLPu9x_M,"Hi, I am watching this video using a  MacBook Air (13-inch, 2017), still working fine and I trust your review. thanks",1,0,2026-03-20T11:43:47Z,hi i am watching this video using a macbook air 13 inch 2017 still working fine and i trust your review thanks,0.0,neutral,0
aJMxLPu9x_M,fcp chlega isme,0,0,2026-03-20T11:23:42Z,fcp chlega isme,0.0,neutral,0
aJMxLPu9x_M,Hi sir ur website is not being working,0,0,2026-03-20T10:52:51Z,hi sir ur website is not being working,0.0,neutral,0
aJMxLPu9x_M,High price 😛😁,0,0,2026-03-20T08:27:33Z,high price,0.0,neutral,0
aJMxLPu9x_M,Feels like M1 chip launched yesterday ! They are releasing new chips every year ! People will get confused,0,0,2026-03-20T08:00:05Z,feels like m1 chip launched yesterday they are releasing new chips every year people will get confused,0.0,neutral,0
aJMxLPu9x_M,Mac book neo❌ Mac book m1✅,0,0,2026-03-20T07:36:00Z,mac book neo mac book m1,0.0,neutral,0
aJMxLPu9x_M,Bakwas laptop h 69999 rs ka😊,0,0,2026-03-19T17:19:17Z,bakwas laptop h 69999 rs ka,0.0,neutral,0
aJMxLPu9x_M,Looks like he is trying to sell us the neo 😅,3,0,2026-03-19T15:47:08Z,looks like he is trying to sell us the neo,0.0,neutral,0
aJMxLPu9x_M,Hello bhaiya ji 🙏 hamse purana shika our not our 3 Hajar bhi lelo please bhaiya ji 🙏 hame iphone 17pro Max dedo please bhaiya ji 🙏,0,0,2026-03-19T15:31:42Z,hello bhaiya ji hamse purana shika our not our 3 hajar bhi lelo please bhaiya ji hame iphone 17pro max dedo please bhaiya ji,0.0,neutral,0
aJMxLPu9x_M,Isse acha to macbook air m2 leleo bhai😂,0,0,2026-03-19T13:59:18Z,isse acha to macbook air m2 leleo bhai,0.0,neutral,0
aJMxLPu9x_M,Sir im Samsung fan ❤🎉,0,0,2026-03-19T12:13:41Z,sir im samsung fan,0.0,neutral,0
aJMxLPu9x_M,Guruji - waiting for you to land in Dubai and go to Gym. You said 10 days back that everything is normal and yeh media wale bahut bada chadake logon ko daraare...hope you landed in Dubai and started Gym....,0,0,2026-03-19T12:10:31Z,guruji waiting for you to land in dubai and go to gym you said 10 days back that everything is normal and yeh media wale bahut bada chadake logon ko daraare hope you landed in dubai and started gym,-0.5,negative,1
aJMxLPu9x_M,Will it work for engineering 🤔??,0,0,2026-03-19T11:01:42Z,will it work for engineering,0.0,neutral,0
aJMxLPu9x_M,guruji❤❤❤❤😂,0,0,2026-03-19T09:58:39Z,guruji,0.0,neutral,0
aJMxLPu9x_M,Kitna commission milgya chhatne ka,0,0,2026-03-19T08:42:11Z,kitna commission milgya chhatne ka,0.0,neutral,0
aJMxLPu9x_M,Technical guruji 👍🏻,0,0,2026-03-19T08:03:58Z,technical guruji,0.0,neutral,0
aJMxLPu9x_M,"Ye coding or development, web development kar payega kyoki abh mai B tech 1st year mai admission luga to kya mai ye sir akhe band kar ke kharid sakta hu bad mai rona to nahi padega",1,0,2026-03-19T07:54:39Z,ye coding or development web development kar payega kyoki abh mai b tech 1st year mai admission luga to kya mai ye sir akhe band kar ke kharid sakta hu bad mai rona to nahi padega,-0.5,negative,1
aJMxLPu9x_M,I can do digital marketing in  this?,0,1,2026-03-19T06:35:46Z,i can do digital marketing in this,0.0,neutral,0
aJMxLPu9x_M,But guru ji ne kaha tha 16 gb ram to hona hi chaiye 2026 me,0,0,2026-03-19T04:57:54Z,but guru ji ne kaha tha 16 gb ram to hona hi chaiye 2026 me,0.0,neutral,0
aJMxLPu9x_M,Sirf tareef ke pull bandh rhe hai 😂....59k me windows laptop acche milte hai coding ke liye aurr gaming bhi ....ye fatt jayega coding mr,0,0,2026-03-19T04:08:11Z,sirf tareef ke pull bandh rhe hai 59k me windows laptop acche milte hai coding ke liye aurr gaming bhi ye fatt jayega coding mr,0.0,neutral,0
aJMxLPu9x_M,Coding???,0,0,2026-03-19T04:06:43Z,coding,0.0,neutral,0
aJMxLPu9x_M,Jai Shree Krishna.,0,0,2026-03-19T03:25:13Z,jai shree krishna,0.0,neutral,0
aJMxLPu9x_M,Gareebo ny AJ Guruji sy laptop chalana b seekh Liya 😂,0,1,2026-03-19T01:30:11Z,gareebo ny aj guruji sy laptop chalana b seekh liya,0.0,neutral,0
aJMxLPu9x_M,Thanks Mr. Gaurav for producing such a knowledgeable review about a new product  which many are curious about to know further. I was here for the first time. Thanks again 🎉,3,0,2026-03-18T22:46:16Z,thanks mr gaurav for producing such a knowledgeable review about a new product which many are curious about to know further i was here for the first time thanks again,0.0,neutral,0
aJMxLPu9x_M,bhai 70 k me windows leke capcut ki jagah adobe premiere pro use kr lunga,0,0,2026-03-18T20:28:57Z,bhai 70 k me windows leke capcut ki jagah adobe premiere pro use kr lunga,0.0,neutral,1
aJMxLPu9x_M,Watching in my Neo 😂,0,0,2026-03-18T19:57:49Z,watching in my neo,0.0,neutral,0
aJMxLPu9x_M,i know this is new product therefore your are excited but after few months you know what is your comments about it ( what ' ' what '' what a fuck $$^^&& what the hack 😁😁😁😆,0,0,2026-03-18T19:35:12Z,i know this is new product therefore your are excited but after few months you know what is your comments about it what what what a fuck what the hack,0.0,neutral,0
aJMxLPu9x_M,what about the windows dell xps. what about the HX . HQ . Hk processors.  what about the open source application in windows . what about the compatibility of windows laptop. windows laptop is all rounder it handle all tasks. games. software. increase RAM / SSD budget laptop  buy window laptop in neo macbook price and then compare both lets see what is difference i am waiting your comparision ( From Saudi Ariba ),0,2,2026-03-18T19:32:39Z,what about the windows dell xps what about the hx hq hk processors what about the open source application in windows what about the compatibility of windows laptop windows laptop is all rounder it handle all tasks games software increase ram ssd budget laptop buy window laptop in neo macbook price and then compare both lets see what is difference i am waiting your comparision from saudi ariba,0.0,neutral,0
aJMxLPu9x_M,"In 2026 is it worth buying MacBook Pro Intel i9 Series Refurbished  laptop , Sir please Reply",0,0,2026-03-18T19:13:26Z,in 2026 is it worth buying macbook pro intel i9 series refurbished laptop sir please reply,0.0,neutral,0
aJMxLPu9x_M,Apple ki chaatna band karo guru,0,0,2026-03-18T18:36:19Z,apple ki chaatna band karo guru,0.0,neutral,0
aJMxLPu9x_M,Gurujii windows ka pta nahi linux kar dega in 4g also😂,0,0,2026-03-18T18:28:30Z,gurujii windows ka pta nahi linux kar dega in 4g also,0.0,neutral,0
aJMxLPu9x_M,Hiiiiii sir,0,0,2026-03-18T18:13:31Z,hiiiiii sir,0.0,neutral,0
aJMxLPu9x_M,Guruji Have Another Level Of Obsession With Apple and It's Products 😂 Guruji ❤ Apple Ecosystem 😅,0,0,2026-03-18T17:51:06Z,guruji have another level of obsession with apple and it s products guruji apple ecosystem,0.0,neutral,0
aJMxLPu9x_M,Guruji just a small suggestion u can make ur intro interesting,0,0,2026-03-18T17:45:47Z,guruji just a small suggestion u can make ur intro interesting,0.5,positive,0
aJMxLPu9x_M,"Software buy krne padenge n
Crack to chalega nhi😢",2,0,2026-03-18T17:43:42Z,software buy krne padenge n crack to chalega nhi,0.0,neutral,1
aJMxLPu9x_M,Kon kon sir ka downfall dekhne aaya hai 😢😊,0,0,2026-03-18T17:37:25Z,kon kon sir ka downfall dekhne aaya hai,0.0,neutral,0
aJMxLPu9x_M,Maine 60k me macbook air m2 16gb 256gb liya. aap air m2 ke current cost pe ise compare karo. Why to compare with windows?,0,0,2026-03-18T17:32:02Z,maine 60k me macbook air m2 16gb 256gb liya aap air m2 ke current cost pe ise compare karo why to compare with windows,0.0,neutral,0
aJMxLPu9x_M,But mai kyu hi 54 apps kholu windows mai?,0,0,2026-03-18T17:19:58Z,but mai kyu hi 54 apps kholu windows mai,0.0,neutral,0
aJMxLPu9x_M,New e-waste 😂,0,0,2026-03-18T17:14:07Z,new e waste,0.0,neutral,0
pxlzbKqx9dY,Jaldi se LIKE aur SHARE kardo #TGFamily!!!,34,5,2026-03-17T11:44:59Z,jaldi se like aur share kardo tgfamily,0.0,neutral,0
pxlzbKqx9dY,Samsung koi model nikal le lekin display line wala issue ka tension nahi jaa raha hai😂😂😂,0,0,2026-03-22T15:14:16Z,samsung koi model nikal le lekin display line wala issue ka tension nahi jaa raha hai,0.0,neutral,0
pxlzbKqx9dY,Bhai mat lena achha nahi hai mene liya hai camera and display is not good,0,0,2026-03-22T14:49:46Z,bhai mat lena achha nahi hai mene liya hai camera and display is not good,0.5,positive,0
